existingItemLabel,newItemLabel,title,subtitle,statedAs,statedAsCreator2,creator,educated at,creatorNew,creatorNew2,CreatorMastersReconciled,creatorDoctoralReconciled,instance of,genre,Den,submittedTo,inception,language,pages,Leaf,page,RomanNumberedPage,degreeSupervisor,degreeSupervisor 1,degreeSupervisor 2,degreeSupervisor 3,degreeSupervisor 4,hdlURI,hdl,OCLCID
,Demographic Characteristics and Diagnostic Performance of Pathologists Who Enjoy Interpreting Melanocytic Skin Lesions,Demographic Characteristics and Diagnostic Performance of Pathologists Who Enjoy Interpreting Melanocytic Skin Lesions,,Andrea Radick,,Andrea Radick,,,,Andrea Radick,,human,master's thesis,"master's thesis by Andrea Radick, 2017",University of Washington,2017,English,28 pages ,,28,,"Elmore, Joann G.,degree supervisor.",Joann G. Elmore,,,,http://hdl.handle.net/1773/40125,1773/40125,1004776034
,"Erectile Dysfunction Drug Use, Risk Behavior, and Sexually Transmitted Diseases","Erectile Dysfunction Drug Use, Risk Behavior, and Sexually Transmitted Diseases",,Tashina Robinson,,Tashina Robinson,,,,Tashina Robinson,,human,master's thesis,"master's thesis by Tashina Robinson, 2016",University of Washington,2016,English,24 pages,,24,,"Manhart, Lisa E.,degree supervisor.",Lisa E. Manhart,,,,http://hdl.handle.net/1773/36666,1773/36666,957559161
,Comprehensive Characterization of Humoral Correlates of Human Immunodeficiency Virus 1 Superinfection Acquisition in High-risk Kenyan Women,Comprehensive Characterization of Humoral Correlates of Human Immunodeficiency Virus 1 Superinfection Acquisition in High-risk Kenyan Women,,Keshet Ronen,,Keshet Ronen,,,,Keshet Ronen,,human,master's thesis,"master's thesis by Keshet Ronen, 2017",University of Washington,2017,English,44 pages ,,44,,"Graham, Susan(Susan Marie),degree supervisor.",Susan(Susan Marie) Graham,,,,http://hdl.handle.net/1773/40123,1773/40123,1004566660
,Evaluating the Efficiency of Community-based Hiv Testing and Counseling Strategies to Decrease Hiv Burden in Sub-saharan Africa,Evaluating the Efficiency of Community-based Hiv Testing and Counseling Strategies to Decrease Hiv Burden in Sub-saharan Africa,,Monisha Sharma,,Monisha Sharma,,,,,Monisha Sharma,human,doctoral thesis,"doctoral thesis by Monisha Sharma, 2016",University of Washington,2016,English,"iv, 208 pages",,208,iv,"Barnabas, Ruanne Vanessa,degree supervisor.",Ruanne Vanessa Barnabas,,,,http://hdl.handle.net/1773/37124,1773/37124,962193129
,New Statin Use and Left Ventricular Structure: Estimating Long-term Associations in the Multi-ethnic Study of Atherosclerosis (mesa),New Statin Use and Left Ventricular Structure,Estimating Long-term Associations in the Multi-ethnic Study of Atherosclerosis (mesa),Lauren N. Strand,,Lauren N Strand,,,,Lauren N Strand,,human,master's thesis,"master's thesis by Lauren N. Strand, 2016",University of Washington,2016,English,"vi, 54 pages",,54,vi,"Delaney, Joseph A. C.,degree supervisor.",Joseph A. C. Delaney,,,,http://hdl.handle.net/1773/37125,1773/37125,962193052
,Evaluating Risk Factors and Synergistic Effects of Two Common Hiv-1 Coinfections: Schistosomiasis and Trichomoniasis,Evaluating Risk Factors and Synergistic Effects of Two Common Hiv-1 Coinfections,Schistosomiasis and Trichomoniasis,Aaron F. Bochner,,Aaron F Bochner,,,,,Aaron F Bochner,human,doctoral thesis,"doctoral thesis by Aaron F. Bochner, 2018",University of Washington,2018,English,"ii, 85 pages",,85,ii,"Barnabas, Ruanne Vanessa,degree supervisor.",Ruanne Vanessa Barnabas,,,,http://hdl.handle.net/1773/43381,1773/43381,1091373790
,Prep (pre-exposure Prophylaxis) Adherence Among East African Women,Prep (pre-exposure Prophylaxis) Adherence Among East African Women,,Maria Pyra,,Maria Pyra,,,,,Maria Pyra,human,doctoral thesis,"doctoral thesis by Maria Pyra, 2018",University of Washington,2018,English,"v, 69 pages  ",,69,v,"Baeten, Jared Murray,1973-degree supervisor.",Jared Murray Baeten,,,,http://hdl.handle.net/1773/43047,1773/43047,1084701810
,Unnecessary Inhaled Corticosteroids in Copd: Understanding Patient and Health System Complexity As Contributors,Unnecessary Inhaled Corticosteroids in Copd,Understanding Patient and Health System Complexity As Contributors,Laura J. Spece,,Laura J Spece,,,,Laura J Spece,,human,master's thesis,"master's thesis by Laura J. Spece, 2018",University of Washington,2018,English,21 pages,,21,,"Smith, Nicholas Lannon,degree supervisor.",Nicholas Lannon Smith,,,,http://hdl.handle.net/1773/43376,1773/43376,1091373528
,Role of Chronic Hepatitis C Virus (hcv) Infection and Host Genetic Variants in Risk of Myocardial Infarction Among People Living With Human Immunodeficiency Virus (hiv),Role of Chronic Hepatitis C Virus (hcv) Infection and Host Genetic Variants in Risk of Myocardial Infarction Among People Living With Human Immunodeficiency Virus (hiv),,Jessica Williams-Nguyen,,Jessica Williams-Nguyen,,,,,Jessica Williams-Nguyen,human,doctoral thesis,"doctoral thesis by Jessica Williams-Nguyen, 2018",University of Washington,2018,English,"v, 68 pages ",,68,v,"Delaney, Joseph A. C.,degree supervisor.",Joseph A. C. Delaney,,,,http://hdl.handle.net/1773/43377,1773/43377,1091373760
,"Urethral Sexual Exposures: Relationship With Prevalent Non-gonococcal Urethritis, the Urethral Microbiota, and Resolution of Symptoms",Urethral Sexual Exposures,"Relationship With Prevalent Non-gonococcal Urethritis, the Urethral Microbiota, and Resolution of Symptoms",Laura C. Chambers,,Laura C Chambers,,,,,Laura C Chambers,human,doctoral thesis,"doctoral thesis by Laura C. Chambers, 2019",University of Washington,2019,English,75 pages ,,75,,"Manhart, Lisa E.,degree supervisor.",Lisa E. Manhart,,,,http://hdl.handle.net/1773/43687,1773/43687,1101439381
,Respiratory Viral Coinfection in a Birth Cohort of Infants in Rural Nepal,Respiratory Viral Coinfection in a Birth Cohort of Infants in Rural Nepal,,Anne Emanuels,,Anne Emanuels,,,,Anne Emanuels,,human,master's thesis,"master's thesis by Anne Emanuels, 2019",University of Washington,2019,English,20 pages ,,20,,"Chu, Helen Y.,degree supervisor.",Helen Y. Chu,,,,http://hdl.handle.net/1773/44228,1773/44228,1121643701
,Commonly Used Medications and Survival From Ovarian Cancer,Commonly Used Medications and Survival From Ovarian Cancer,,Barbara N. Harding,,Barbara N Harding,Syracuse University,,,,Barbara N Harding,human,doctoral thesis,"doctoral thesis by Barbara N. Harding, 2019",University of Washington,2019,English,"v, 43 pages ",,43,v,"Weiss, Noel S.,1941-degree supervisor.",Noel S. Weiss,,,,http://hdl.handle.net/1773/44253,1773/44253,1122618036
,The Agreement Between Emergency Department and Intensive Care Unit Depth of Sedation Assessment,The Agreement Between Emergency Department and Intensive Care Unit Depth of Sedation Assessment,,Sharukh Lokhandwala,,Sharukh Lokhandwala,,,,Sharukh Lokhandwala,,human,master's thesis,"master's thesis by Sharukh Lokhandwala, 2019",University of Washington,2019,English,"iv, iii, 12 pages ",,12,vii,"Heckbert, Susan R.,degree supervisor.",Susan R. Heckbert,,,,http://hdl.handle.net/1773/44254,1773/44254,1122618191
,Effect of Periconceptual Vaginal Microbiota Disruption On Fecundability Among Kenyan Women Planning Pregnancies,Effect of Periconceptual Vaginal Microbiota Disruption On Fecundability Among Kenyan Women Planning Pregnancies,,Erica M. Lokken,,Erica M Lokken,,,,,Erica M Lokken,human,doctoral thesis,"doctoral thesis by Erica M. Lokken, 2019",University of Washington,2019,English,109 pages ,,109,,"McClelland, R. Scott(Raymond Scott),degree supervisor.",R. Scott(Raymond Scott) McClelland,,,,http://hdl.handle.net/1773/44814,1773/44814,1129261470
,What's Prep?: Examining Factors Associated With Prep Peer Navigator Acceptability Among Black and Latinx Msm in Western Washington,What's Prep?,Examining Factors Associated With Prep Peer Navigator Acceptability Among Black and Latinx Msm in Western Washington,Jade Pagkas-Bather,,Jade Pagkas-Bather,,,,Jade Pagkas-Bather,,human,master's thesis,"master's thesis by Jade Pagkas-Bather, 2019",University of Washington,2019,English,30 pages ,,30,,"Graham, Susan(Susan Marie),degree supervisor.",Susan(Susan Marie) Graham,,,,http://hdl.handle.net/1773/44229,1773/44229,1121643688
,Humoral Response to Hpv16 Proteins in Patients With Anal High-grade Squamous Intraepithelial Lesion and Anal Cancer,Humoral Response to Hpv16 Proteins in Patients With Anal High-grade Squamous Intraepithelial Lesion and Anal Cancer,,Helen Stankiewicz Karita,,Helen C Stankiewicz Karita,,,,Helen C Stankiewicz Karita,,human,master's thesis,"master's thesis by Helen Stankiewicz Karita, 2019",University of Washington,2019,English,30 pages ,,30,,"Madeleine, Margaret M.,degree supervisor.",Margaret M. Madeleine,,,,http://hdl.handle.net/1773/43685,1773/43685,1101439077
,"Long-term Air Pollution in Relation to Cardiac Structure, Function, and Supraventricular Arrhythmias","Long-term Air Pollution in Relation to Cardiac Structure, Function, and Supraventricular Arrhythmias",,Thomas R. Austin,,Thomas R Austin,,,,,Thomas R Austin,human,doctoral thesis,"doctoral thesis by Thomas R. Austin, 2020",University of Washington,2020,English,"2 pages, v, 72 pages ",,74,v,"Heckbert, Susan R.,degree supervisor.",Susan R. Heckbert,,,,http://hdl.handle.net/1773/46464,1773/46464,1248744821
,Utilization of Systemic Therapy in Cancer Patients Near the End-of-life in the Pre- Vs. Post- Checkpoint Inhibitor Eras,Utilization of Systemic Therapy in Cancer Patients Near the End-of-life in the Pre- Vs. Post- Checkpoint Inhibitor Eras,,Ali Raza Khaki,,Ali Raza Khaki,,,,Ali Raza Khaki,,human,master's thesis,"master's thesis by Ali Raza Khaki, 2020",University of Washington,2020,English,21 pages ,,21,,"Schwartz, Stephen M.,degree supervisor.",Stephen M. Schwartz,,,,http://hdl.handle.net/1773/46800,1773/46800,1260699273
,"Effects of Washington's Opioid Prescribing Rules For Chronic, Non-cancer Pain Management On Opioid Overdose Mortality and Pharmaceutical Opioid Distribution: 1999-2017","Effects of Washington's Opioid Prescribing Rules For Chronic, Non-cancer Pain Management On Opioid Overdose Mortality and Pharmaceutical Opioid Distribution",1999-2017,Soyeon I. Lippman,,Soyeon I Lippman,,,,Soyeon I Lippman,,human,master's thesis,"master's thesis by Soyeon I. Lippman, 2020",University of Washington,2020,English,"vi, 33 pages ",,33,vi,"Weiss, Noel S.,1941-degree supervisor.",Noel S. Weiss,,,,http://hdl.handle.net/1773/45492,1773/45492,1155437499
,"Care-seeking Correlates of Acute Respiratory Illness Among Sheltered Homeless Adults in Seattle, Wa: A Community-based Cross-sectional Study","Care-seeking Correlates of Acute Respiratory Illness Among Sheltered Homeless Adults in Seattle, Wa",A Community-based Cross-sectional Study,Julia H. Rogers,,Julia H Rogers,,,,Julia H Rogers,,human,master's thesis,"master's thesis by Julia H. Rogers, 2020",University of Washington,2020,English,23 pages ,,23,,"Chu, Helen Y.,degree supervisor.",Helen Y. Chu,,,,http://hdl.handle.net/1773/46798,1773/46798,1260705793
,Evolutionary Relationships of the Enigmatic Anglerfishes (teleostei:lophiiformes): Can Nuclear Dna Provide Resolution For Conflicting Morphological and Mitochondrial Phylogenies?,Evolutionary Relationships of the Enigmatic Anglerfishes (teleostei:lophiiformes),Can Nuclear Dna Provide Resolution For Conflicting Morphological and Mitochondrial Phylogenies?,Rachel J. Arnold,,Rachel J. Arnold,,,,,Rachel J. Arnold,human,doctoral thesis,"doctoral thesis by Rachel J. Arnold, 2014",University of Washington,2014,English,"v, 83 pages ",,83,v,"Pietsch, Theodore W.,degree supervisor.",Theodore W. Pietsch,,,,http://hdl.handle.net/1773/27481,1773/27481,904357775
,"Spatial -temporal Patterns in Distribution and Feeding of Juvenile Salmon and Herring in Puget Sound, Wa","Spatial -temporal Patterns in Distribution and Feeding of Juvenile Salmon and Herring in Puget Sound, Wa",,Iris M. Kemp,,Iris M. Kemp,,,,Iris M. Kemp,,human,master's thesis,"master's thesis by Iris M. Kemp, 2014",University of Washington,2014,English,"v, 123 pages ",,123,v,"Beauchamp, David A.,degree supervisor.",David A. Beauchamp,,,,http://hdl.handle.net/1773/25415,1773/25415,890810143
,Contemporary Controls and Future Predictions of Non-native Smallmouth Bass Range Expansion Into Salmon-rearing Habitat,Contemporary Controls and Future Predictions of Non-native Smallmouth Bass Range Expansion Into Salmon-rearing Habitat,,David James Lawrence,,James David Lawrence,,,,,James David Lawrence,human,doctoral thesis,"doctoral thesis by David James Lawrence, 2013",University of Washington,2013,English,"ix, 198 pages ",,198,ix,"Olden, Julian David,1975-degree supervisor.",Julian David Olden,,,,http://hdl.handle.net/1773/24339,1773/24339,881765465
,Utility and Implications of No-take Marine Reserves in Fishery Management Strategies,Utility and Implications of No-take Marine Reserves in Fishery Management Strategies,,Carey R. McGilliard,,Carey R McGilliard,,,,,Carey R McGilliard,human,doctoral thesis,"doctoral thesis by Carey R. McGilliard, 2012",University of Washington,2012,English,"iv, 159 pages ",,159,iv,"Hilborn, Ray,1947-thesis advisor.",Ray Hilborn,,,,http://hdl.handle.net/1773/20744,1773/20744,821640363
,Genetic Differentiation of Chum Salmon (oncorhynchus Keta) in Alaska Influenced By Glacial History,Genetic Differentiation of Chum Salmon (oncorhynchus Keta) in Alaska Influenced By Glacial History,,Eleni L. Petrou,,Eleni L. Petrou,University of Washington,,,Eleni L. Petrou,,human,master's thesis,"master's thesis by Eleni L. Petrou, 2012",University of Washington,2012,English,"v, 74 pages ",,74,v,"Seeb, Lisa Wishard,thesis advisor.",Lisa Wishard Seeb,,,,http://hdl.handle.net/1773/22566,1773/22566,874918507
,"History and Extent of Introgressive Hybridization in Puget Sound Rockfishes (sebastes Auriculatus, S. Caurinus, and S. Maliger)","History and Extent of Introgressive Hybridization in Puget Sound Rockfishes (sebastes Auriculatus, S. Caurinus, and S. Maliger)",,Piper Schwenke,,Piper L Schwenke,,,,Piper L Schwenke,,human,master's thesis,"master's thesis by Piper Schwenke, 2012",University of Washington,2012,English,"vi, 77 pages ",,77,vi,"Hauser, Lorenz,thesis advisor.",Lorenz Hauser,,,,http://hdl.handle.net/1773/21967,1773/21967,851210094
,An Exploration of Speciation and Genome-wide Uncertainty in Flatfishes Based On Exon-capture Data,An Exploration of Speciation and Genome-wide Uncertainty in Flatfishes Based On Exon-capture Data,,Calder J. Atta,,Calder J Atta,,,,Calder J Atta,,human,master's thesis,"master's thesis by Calder J. Atta, 2020",University of Washington,2020,English,"2 pages, i, 100 pages ",,102,i,"Tornabene, Luke,degree supervisor.",Luke Tornabene,,,,http://hdl.handle.net/1773/46472,1773/46472,1246316279
,"Salmonid Life History, Phenology, and Distribution Within a Large River Basin","Salmonid Life History, Phenology, and Distribution Within a Large River Basin",,Catherine S. Austin,,Catherine S Austin,,,,,Catherine S Austin,human,doctoral thesis,"doctoral thesis by Catherine S. Austin, 2020",University of Washington,2020,English,"xii, 144 pages ",,144,xii,"Quinn, Thomas P.(Thomas Peter),degree supervisor.",Thomas P.(Thomas Peter) Quinn,,,,http://hdl.handle.net/1773/46011,1773/46011,1196908893
Korean stock structure and transoceanic divergence in Pacific cod (Gadus macrocephalus),,Korean Stock Structure and Transoceanic Divergence in Pacific Cod (gadus Macrocephalus),,Mary Fisher,,Mary Fisher,University of Washington,,,Mary Fisher,,human,master's thesis,"master's thesis by Mary Fisher, 2018",University of Washington,2018,English,"vi, 124 pages ",,124,vi,"Hauser, Lorenz,degree supervisor.",Lorenz Hauser,,,,http://hdl.handle.net/1773/43058,1773/43058,1084737220
The influence of the Columbia River plume on predator-prey interactions,,The Influence of the Columbia River Plume On Predator-prey Interactions,,Elizabeth M. Phillips,,Elizabeth M. Phillips,University of Washington,,,,Elizabeth M. Phillips,human,doctoral thesis,"doctoral thesis by Elizabeth M. Phillips, 2018",University of Washington,2018,English,"xiv, 176 pages  ",,176,xiv,"Horne, John K.,degree supervisor.",John K. Horne,,,,http://hdl.handle.net/1773/43057,1773/43057,1084737346
Stock Status and Management in Tuna Fisheries: From Data-Rich to Data-Poor,,Stock Status and Management in Tuna Fisheries,From Data-rich to Data-poor,Maite Pons,,Maite Pons,University of Washington,,,,Maite Pons,human,doctoral thesis,"doctoral thesis by Maite Pons, 2018",University of Washington,2018,English,"xiii, 165 pages ",,165,xiii,"Hilborn, Ray,1947-degree supervisor.",Ray Hilborn,,,,http://hdl.handle.net/1773/43059,1773/43059,1084737306
,Influence of Urbanization On the Health of Juvenile Salmonids in Pacific Northwest Perennial Streams,Influence of Urbanization On the Health of Juvenile Salmonids in Pacific Northwest Perennial Streams,,Andrew R. Spanjer,,Andrew R. Spanjer,University of Washington,,,Andrew R. Spanjer,,human,master's thesis,"master's thesis by Andrew R. Spanjer, 2017",University of Washington,2017,English,"v, 135 pages ",,135,v,"Beauchamp, David A.,degree supervisor.",David A. Beauchamp,,,,http://hdl.handle.net/1773/40575,1773/40575,1015925450
,Contemporary Population Genetic Structure and Phylogeography of Pink Salmon,Contemporary Population Genetic Structure and Phylogeography of Pink Salmon,,Carolyn Tarpey,,Carolyn M Tarpey,,,,Carolyn M Tarpey,,human,master's thesis,"master's thesis by Carolyn Tarpey, 2016",University of Washington,2016,English,"x, 43 pages ",,43,x,"Seeb, Lisa Wishard,degree supervisor.",Lisa Wishard Seeb,,,,http://hdl.handle.net/1773/37128,1773/37128,962333016
,Population Genomics of Salish Sea Chum Salmon: The Legacy of the Salmonid Whole Genome Duplication,Population Genomics of Salish Sea Chum Salmon,The Legacy of the Salmonid Whole Genome Duplication,Ryan K. Waples,,Ryan K Waples,,,,Ryan K Waples,,human,master's thesis,"master's thesis by Ryan K. Waples, 2015",University of Washington,2015,English,64 pages ,,64,,"Seeb, Lisa Wishard,degree supervisor.",Lisa Wishard Seeb,,,,http://hdl.handle.net/1773/35204,1773/35204,946448035
,Landscape- and Regional-level Correlative Modeling Techniques For the Prediction of Ecological Processes,Landscape- and Regional-level Correlative Modeling Techniques For the Prediction of Ecological Processes,,Nicholas A. Povak,,Nicholas A. Povak,University of Washington,,,,Nicholas A. Povak,human,doctoral thesis,"doctoral thesis by Nicholas A. Povak, 2012",University of Washington,2012,English,167 pages ,,167,,"Franklin, Jerry F.,thesis advisor.",Jerry F. Franklin,,,,http://hdl.handle.net/1773/22659,1773/22659,875475722
,Local and Landscape-scale Influences of Bee Abundance and Diversity in Residential Gardens,Local and Landscape-scale Influences of Bee Abundance and Diversity in Residential Gardens,,Hillary K. Burgess,,Hillary K Burgess,,,,Hillary K Burgess,,human,master's thesis,"master's thesis by Hillary K. Burgess, 2013",University of Washington,2013,English,"iv, 58 pages ",,58,iv,"Reichard, Sarah H.,degree supervisor.",Sarah H. Reichard,,,,http://hdl.handle.net/1773/24121,1773/24121,881291506
,"Using Aerial Photos to Produce Digital Surface Models, Orthophotos, and Land Cover Maps of a Coastal Area in Puget Sound, Wa","Using Aerial Photos to Produce Digital Surface Models, Orthophotos, and Land Cover Maps of a Coastal Area in Puget Sound, Wa",,Jonnie Dunne,,Jonnie B Dunne,,,,Jonnie B Dunne,,human,master's thesis,"master's thesis by Jonnie Dunne, 2015",University of Washington,2015,English,"iv, 46 pages ",,46,iv,"Moskal, L. Monika,1972-degree supervisor.",L. Monika Moskal,,,,http://hdl.handle.net/1773/33924,1773/33924,935404905
,Bioretention Soil Media: Understanding the Effects of Compost and Finding Predictors For Phosphorus Leaching,Bioretention Soil Media,Understanding the Effects of Compost and Finding Predictors For Phosphorus Leaching,Julia Jay,,Julia Jay,,,,Julia Jay,,human,master's thesis,"master's thesis by Julia Jay, 2016",University of Washington,2016,English,181 pages ,,181,,"Brown, Sally,1959-degree supervisor.",Sally Brown,,,,http://hdl.handle.net/1773/38144,1773/38144,982959503
Leaf area index in riparian forests: estimation with airborne lidar vs. airborne structure-from-motion and the societal value of remotely sensed ecological information,,Leaf Area Index in Riparian Forests,Estimation With Airborne Lidar Vs. Airborne Structure-from-motion and the Societal Value of Remotely Sensed Ecological Information,Travis Axe,,Travis Axe,University of Washington,,,Travis Axe,,human,master's thesis,"master's thesis by Travis Axe, 2018",University of Washington,2018,English,"93 pages, 94-103 pages ",,103,,"Moskal, L. Monika,1972-degree supervisor.;Thomas, Craig W.(Associate professor of political science),degree supervisor.",L. Monika Moskal, Craig W.(Associate professor of political science) Thomas,,,http://hdl.handle.net/1773/42361,1773/42361,1080590048
Comparison between Catalytic Fast Pyrolysis and Catalytic Fast Hydropyrolysis of Arundo donax in a Fluidized Bed Reactor,,Comparison Between Catalytic Fast Pyrolysis and Catalytic Fast Hydropyrolysis of Arundo Donax in a Fluidized Bed Reactor,,Devin Chandler,,Devin Chandler,University of Washington,,,Devin Chandler,,human,master's thesis,"master's thesis by Devin Chandler, 2018",University of Washington,2018,English,42 pages ,,42,,"Resende, Fernando(Fernando L. P.),degree supervisor.",Fernando(Fernando L. P.) Resende,,,,http://hdl.handle.net/1773/43068,1773/43068,1085673755
Environmental assessment of the production and end-of-life of cross-laminated timber in western Washington,,Environmental Assessment of the Production and End-of-life of Cross-laminated Timber in Western Washington,,Cindy Xiaoning Chen,,Cindy Xiaoning Chen,University of Washington,,,,Cindy Xiaoning Chen,human,doctoral thesis,"doctoral thesis by Cindy Xiaoning Chen, 2019",University of Washington,2019,English,"xiii, 176 pages ",,176,xiii,"Ganguly, Indroneil,degree supervisor.http://www.wikidata.org/entity/Q104098040",Q104098040,,,,http://hdl.handle.net/1773/44267,1773/44267,1122629775
"Is sweetgrass on the decline? response of Schoenoplectus pungens (M. Vahl) Palla var. badius (K. Presl) S. G. Smith to environmental variables, cultural use, and anthropogenic change in Grays Harbor, Washington",,"Is Sweetgrass On the Decline? Response of Schoenoplectus Pungens (m. Vahl) Palla Var. Badius (k. Presl) S. G. Smith to Environmental Variables, Cultural Use, and Anthropogenic Change in Grays Harbor, Washington",,Caren Jane Crandell,,Caren Jane Crandell,University of Washington,,,,Caren Jane Crandell,human,doctoral thesis,"doctoral thesis by Caren Jane Crandell, 2018",University of Washington,2018,English,345 pages ,,345,,"Ewing, Kern,degree supervisor.",Kern Ewing,,,,http://hdl.handle.net/1773/43389,1773/43389,1091373594
The association between wildfire emitted PM2.5 and hospital admissions in the greater Seattle area,,The Association Between Wildfire Emitted Pm2.5 and Hospital Admissions in the Greater Seattle Area,,Lesly Joanne Franco Deloya,,Lesly Joanne Franco Deloya,University of Washington,,,Lesly Joanne Franco Deloya,,human,master's thesis,"master's thesis by Lesly Joanne Franco Deloya, 2018",University of Washington,2018,English,"vii, 46 pages ",,46,vii,"Alvarado, Ernesto,degree supervisor.",Ernesto Alvarado,,,,http://hdl.handle.net/1773/43384,1773/43384,1091373610
An Exploratory Analysis of Environmentally-Certified Wood Products (ECWPs) in the Residential Leadership in Energy and Environmental Design (LEED) Market: 2018 and 2011,,An Exploratory Analysis of Environmentally-certified Wood Products (ecwps) in the Residential Leadership in Energy and Environmental Design (leed) Market,2018 and 2011,Olivia Jacobs,,Olivia Jacobs,University of Washington,,,Olivia Jacobs,,human,master's thesis,"master's thesis by Olivia Jacobs, 2019",University of Washington,2019,English,"108, 18 pages ",,126,,"Ganguly, Indroneil,degree supervisor.http://www.wikidata.org/entity/Q104098040",Q104098040,,,,http://hdl.handle.net/1773/44268,1773/44268,1122858862
"Restoring forest resilience in the Sierra Nevada mixed-conifer zone, with a focus on measuring spatial patterns of trees using airborne lidar",,"Restoring Forest Resilience in the Sierra Nevada Mixed-conifer Zone, With a Focus On Measuring Spatial Patterns of Trees Using Airborne Lidar",,Sean Medeiros Alexander Jeronimo,,Sean Medeiros Alexander Jeronimo,University of Washington,,,,Sean Medeiros Alexander Jeronimo,human,doctoral thesis,"doctoral thesis by Sean Medeiros Alexander Jeronimo, 2018",University of Washington,2018,English,"vi, 308 pages  ",,308,vi,"Franklin, Jerry F.,degree supervisor.;Kane, Van R.,degree supervisor.",Jerry F. Franklin, Van R. Kane,,,http://hdl.handle.net/1773/43063,1773/43063,1084740043
Using Lidar Data to Predict Photo Interpreted Attributes,,Using Lidar Data to Predict Photo Interpreted Attributes,,Miles Elliot LeFevre,,Miles Elliot LeFevre,University of Washington,,,Miles Elliot LeFevre,,human,master's thesis,"master's thesis by Miles Elliot LeFevre, 2018",University of Washington,2018,English,"iv, 40 pages  ",,40,iv,"Franklin, Jerry F.,degree supervisor.",Jerry F. Franklin,,,,http://hdl.handle.net/1773/43069,1773/43069,1085673775
,"The Importance of Discovery Park's Relative Wildness in the Urban Landscape: History, Human-nature Interaction, and Just Management",The Importance of Discovery Park's Relative Wildness in the Urban Landscape,"History, Human-nature Interaction, and Just Management",Elizabeth M. Lev,,Elizabeth M. Lev,University of Washington,,,Elizabeth M. Lev,,human,master's thesis,"master's thesis by Elizabeth M. Lev, 2019",University of Washington,2019,English,96 pages ,,96,,"Kahn, Peter H.,Jr.,degree supervisor.http://www.wikidata.org/entity/Q84206467",Q84206467,,,,http://hdl.handle.net/1773/45197,1773/45197,1141793933
