existingItemLabel,newItemLabel,title,subtitle,statedAs,statedAsCreator2,creator,educated at,creatorNew,creatorNew2,CreatorMastersReconciled,creatorDoctoralReconciled,instance of,genre,Den,submittedTo,inception,language,pages,Leaf,page,RomanNumberedPage,degreeSupervisor,degreeSupervisor 1,degreeSupervisor 2,degreeSupervisor 3,degreeSupervisor 4,hdlURI,hdl,OCLCID
"Translating ""transition"": a Case Study in Interpreting Seventeenth Century German Church Music Through a Survey of Three Settings of Christ Lag in Todesbanden",,"Translating ""transition""",A Case Study in Interpreting Seventeenth Century German Church Music Through a Survey of Three Settings of Christ Lag in Todesbanden,Ryan Michael Mullaney,,Ryan Mullaney,University of Washington,,,,Ryan Mullaney,human,doctoral thesis,"doctoral thesis by Ryan Michael Mullaney, 2018",University of Washington,2018,English,"x, 214 pages  ",,214,x,"Boers, Geoffrey,degree supervisor.http://www.wikidata.org/entity/Q99629065",Q99629065,,,,http://hdl.handle.net/1773/43110,1773/43110,1085911078
Degenerate,,Degenerate,,Sandesh Nagaraj,,Sandesh Nagaraj,University of Washington,,,Sandesh Nagaraj,,human,master's thesis,"master's thesis by Sandesh Nagaraj, 2020",University of Washington,2020,English,19 pages,,19,,"Durand, Joël-François,degree supervisorhttp://www.wikidata.org/entity/Q684032",Q684032,,,,http://hdl.handle.net/1773/46134,1773/46134,1196250005
A Voice in the Choir: Modernizing the Language and Practice of Voice Pedagogy in the Choral Culture,,A Voice in the Choir,Modernizing the Language and Practice of Voice Pedagogy in the Choral Culture,Jennifer M. Rodgers,,Jennifer Rodgers,University of Washington,,,,Jennifer Rodgers,human,doctoral thesis,"doctoral thesis by Jennifer M. Rodgers, 2020",University of Washington,2020,English,"ix, 198 pages",,198,ix,"Boers, Geoffrey,degree supervisor.http://www.wikidata.org/entity/Q99629065",Q99629065,,,,http://hdl.handle.net/1773/46132,1773/46132,1196249704
String Quartet,,String Quartet,,Alisa Sargsyan,,Alisa Sargsyan,University of Washington,,,Alisa Sargsyan,,human,master's thesis,"master's thesis by Alisa Sargsyan, 2017",University of Washington,2017,English,39 pages ,,39,,"Durand, Joël-François,degree supervisor.http://www.wikidata.org/entity/Q684032;Karpen, Richard,1957-degree supervisor.http://www.wikidata.org/entity/Q7326996",Q684032,http://www.wikidata.org/entity/Q7326996,,,http://hdl.handle.net/1773/38664,1773/38664,990793647
"Formless Being: For Flute, Clarinet, Bassoon, French Horn, Percussion, Piano and String Quartet",,Formless Being,"For Flute, Clarinet, Bassoon, French Horn, Percussion, Piano and String Quartet",Anna Stachurska,,Anna Stachurska,University of Washington,,,,Anna Stachurska,human,doctoral thesis,"doctoral thesis by Anna Stachurska, 2016",University of Washington,2016,English,1 score 24 pages,, 24,,"Durand, Joël-François,degree supervisor.http://www.wikidata.org/entity/Q684032",Q684032,,,,http://hdl.handle.net/1773/37197,1773/37197,983208937
"Wind Chamber Music by Women Composers: The Biographies, Compositional Techniques, and Perspectives of Jocelyn Morlock, Elizabeth Raum, Marilyn Shrude, and Augusta Read Thomas",,Wind Chamber Music By Women Composers,"The Biographies, Compositional Techniques, and Perspectives of Jocelyn Morlock, Elizabeth Raum, Marilyn Shrude, and Augusta Read Thomas",Shayna Stahl,,Shayna Stahl,University of Washington,,,,Shayna Stahl,human,doctoral thesis,"doctoral thesis by Shayna Stahl, 2019",University of Washington,2019,English,"viii, 223 pages ",,223,viii,"Salzman, Timothy,1955-degree supervisor.http://www.wikidata.org/entity/Q99534507",Q99534507,,,,http://hdl.handle.net/1773/44406,1773/44406,1125265082
A Comparative Study of Four American Professional Wind Bands,,A Comparative Study of Four American Professional Wind Bands,,Mark Tse,,Mark Tse,University of Washington,,,,Mark Tse,human,doctoral thesis,"doctoral thesis by Mark Tse, 2020",University of Washington,2020,English,167 pages ,,167,,"Salzman, Timothy,1955-degree supervisor.http://www.wikidata.org/entity/Q99534507",Q99534507,,,,http://hdl.handle.net/1773/46133,1773/46133,1196249756
A Visit to the Sky-mother Mountain: For Ensemble,,A Visit to the Sky-mother Mountain,For Ensemble = Tianmu You Ji,Lu Yin,,Lu Yin,University of Washington,,,Lu Yin,,human,master's thesis,"master's thesis by Lu Yin, 2020",University of Washington,2020,English,"1 score 8 pages, 18 pages",,26,,"880-03Inspired by (work):Li, Bai,701-762.Meng you tian lao yin bie liu.;Durand, Joël-François,degree supervisor.http://www.wikidata.org/entity/Q684032",Q684032,,,,http://hdl.handle.net/1773/46131,1773/46131,1196249726
,"Wandering Rocks: For Flute, Clarinet, Violin, Cello and Piano",Wandering Rocks,"For Flute, Clarinet, Violin, Cello and Piano",Eric Flesher,,Eric Flesher,University of Washington,,,,Eric Flesher,human,doctoral thesis,"doctoral thesis by Eric Flesher, 2002",University of Washington,2002,English,"1 score ii, 59 leaves",59,,ii,"Durand, Joël-François,degree supervisor.http://www.wikidata.org/entity/Q684032",Q684032,,,,http://hdl.handle.net/1773/11331,1773/11331,52077672
,Mosaik: Für Ensemble,Mosaik,Für Ensemble,Michael Rook,,Michael Rook,University of Washington,,,,Michael Rook,human,doctoral thesis,"doctoral thesis by Michael Rook, 2003",University of Washington,2003,English,"1 study score vii, 66 leaves",66,,vii,"Durand, Joël-François,degree supervisor.http://www.wikidata.org/entity/Q684032",Q684032,,,,http://hdl.handle.net/1773/11282,1773/11282,54894318
,Architecture and Nation-building in Mid-20th Century Urban Turkey and Iraq,Architecture and Nation-building in Mid-20th Century Urban Turkey and Iraq,,Lydia Harrington,,Lydia Harrington,,,,Lydia Harrington,,human,master's thesis,"master's thesis by Lydia Harrington, 2014",University of Washington,2014,English,60 pages ,,60,,"Kuru, Selim S.,degree supervisor.",Selim S. Kuru,,,,http://hdl.handle.net/1773/26487,1773/26487,895084958
,"Fly, Robot: the Use of a Controllable Fly Robot to Explore Object Recognition and Visual Tracking During Courtship in Drosophila","Fly, Robot: the Use of a Controllable Fly Robot to Explore Object Recognition and Visual Tracking During Courtship in Drosophila",,Sweta Agrawal,,Sweta Agrawal,,,,,Sweta Agrawal,human,doctoral thesis,"doctoral thesis by Sweta Agrawal, 2015",University of Washington,2015,English,"ix, 65 pages ",,65,ix,"Dickinson, Michael H.,1963-degree supervisor.",Michael H. Dickinson,,,,http://hdl.handle.net/1773/35126,1773/35126,945931519
,The Role of the Fefsem in Smooth Pursuit: Insights From Varying Retinal Input,The Role of the Fefsem in Smooth Pursuit,Insights From Varying Retinal Input,Leah Bakst,,Leah Bakst,,,,,Leah Bakst,human,doctoral thesis,"doctoral thesis by Leah Bakst, 2016",University of Washington,2016,English,"ix, 143",,143,ix,"Mustari, Michael J.,degree supervisor.",Michael J. Mustari,,,,http://hdl.handle.net/1773/38059,1773/38059,981483266
,Striatal 5-ht₆ Receptors: Roles in Cocaine Reinforcement and Neuronal Primary Cilia,Striatal 5-ht₆ Receptors,Roles in Cocaine Reinforcement and Neuronal Primary Cilia,Matthew Brodsky,,Matthew Brodsky,,,,,Matthew Brodsky,human,doctoral thesis,"doctoral thesis by Matthew Brodsky, 2016",University of Washington,2016,English,"x, 110 pages ",,110,x,"Neumaier, John Fredric,1961-degree supervisor.",John Fredric Neumaier,,,,http://hdl.handle.net/1773/35531,1773/35531,948519874
,Auditory Perception and the Electrode-neuron Interface in Children and Adults With Cochlear Implants,Auditory Perception and the Electrode-neuron Interface in Children and Adults With Cochlear Implants,,Mishaela DiNino,,Mishaela DiNino,,,,,Mishaela DiNino,human,doctoral thesis,"doctoral thesis by Mishaela DiNino, 2018",University of Washington,2018,English,"xii, 145 pages ",,145,xii,"Arenberg, Julie G.,degree supervisor.",Julie G. Arenberg,,,,http://hdl.handle.net/1773/42197,1773/42197,1066743803
,The Role of Muscarinic Cholinergic Signaling in Cost-benefit Decision Making,The Role of Muscarinic Cholinergic Signaling in Cost-benefit Decision Making,,Wambura Fobbs,,Wambura C Fobbs,,,,,Wambura C Fobbs,human,doctoral thesis,"doctoral thesis by Wambura Fobbs, 2016",University of Washington,2016,English,"vi, 110 pages ",,110,vi,"Mizumori, Sheri Jane,degree supervisor.",Sheri Jane Mizumori,,,,http://hdl.handle.net/1773/37024,1773/37024,960818593
,The Roles of Extra-synaptic Serotonin Receptors in Neuronal Signaling and Behavior,The Roles of Extra-synaptic Serotonin Receptors in Neuronal Signaling and Behavior,,Alec W. Gibson,,Alec W Gibson,University of Washington,,,,Alec W Gibson,human,doctoral thesis,"doctoral thesis by Alec W. Gibson, 2020",University of Washington,2020,English,110 pages ,,110,,"Neumaier, John Fredric,1961-degree supervisor.",John Fredric Neumaier,,,,http://hdl.handle.net/1773/45441,1773/45441,1154495123
,"Towards Finding a Link Between Neuronal Oscillations, Declarative Memory, and Viewing Behavior","Towards Finding a Link Between Neuronal Oscillations, Declarative Memory, and Viewing Behavior",,Gabriel Obregon-Henao,,Gabriel Obregon-Henao,,,,Gabriel Obregon-Henao,,human,master's thesis,"master's thesis by Gabriel Obregon-Henao, 2020",University of Washington,2020,English,17 pages ,,17,,"Buffalo, Elizabeth,degree supervisor.",Elizabeth Buffalo,,,,http://hdl.handle.net/1773/46376,1773/46376,1243927674
,Biophysical Population Models of the Auditory Nerve,Biophysical Population Models of the Auditory Nerve,,Gabrielle O'Brien,,Gabrielle O'Brien,University of Washington,,,Gabrielle O'Brien,,human,master's thesis,"master's thesis by Gabrielle O'Brien, 2016",University of Washington,2016,English,"vi, 102 pages ",,102,vi,"Rubinstein, Jay T.(Jay Tal),degree supervisor.",Jay T.(Jay Tal) Rubinstein,,,,http://hdl.handle.net/1773/35530,1773/35530,948520304
,Characterizing the Role of Accumbens Medium Spiny Neurons in Vulnerability to Heroin Addiction,Characterizing the Role of Accumbens Medium Spiny Neurons in Vulnerability to Heroin Addiction,,Timothy J. O'Neal,,Timothy J O'Neal,,,,,Timothy J O'Neal,human,doctoral thesis,"doctoral thesis by Timothy J. O'Neal, 2021",University of Washington,2021,English,"iv pages, 5 pages, 112 pages ",,117,iv,"Ferguson, Susan M.(Susan Marie),degree supervisor.",Susan M.(Susan Marie) Ferguson,,,,http://hdl.handle.net/1773/47007,1773/47007,1275393193
,Stimulating Retinal Neurogenesis From Müller Glia,Stimulating Retinal Neurogenesis From Müller Glia,,Julia Pollak,,Julia Pollak,,,,,Julia Pollak,human,doctoral thesis,"doctoral thesis by Julia Pollak, 2013",University of Washington,2013,English,"v, 135 pages ",,135,v,"Reh, Thomas A.,degree supervisor.",Thomas A. Reh,,,,http://hdl.handle.net/1773/25049,1773/25049,882112268
,Simulating the Effects of Neural Pathology On Cochlear Implant Responses,Simulating the Effects of Neural Pathology On Cochlear Implant Responses,,Jesse M. Resnick,,Jesse M Resnick,University of Washington,,,,Jesse M Resnick,human,doctoral thesis,"doctoral thesis by Jesse M. Resnick, 2019",University of Washington,2019,English,164 pages ,,164,,"Rubinstein, Jay T.(Jay Tal),degree supervisor.",Jay T.(Jay Tal) Rubinstein,,,,http://hdl.handle.net/1773/44036,1773/44036,1117497430
,The Role of Hypocretin in Post-traumatic Brain Injury Sleep-wake Disturbance,The Role of Hypocretin in Post-traumatic Brain Injury Sleep-wake Disturbance,,Hannah Thomasy,,Hannah Thomasy,,,,,Hannah Thomasy,human,doctoral thesis,"doctoral thesis by Hannah Thomasy, 2017",University of Washington,2017,English,130 pages ,,130,,"Opp, Mark R.,1956-degree supervisor.",Mark R. Opp,,,,http://hdl.handle.net/1773/40837,1773/40837,1031119054
,The Ins of the Striatum: Utilizing Chemogenetics to Define the Contribution of Cortical and Thalamic Afferents During Addiction Behaviors,The Ins of the Striatum,Utilizing Chemogenetics to Define the Contribution of Cortical and Thalamic Afferents During Addiction Behaviors,Amanda M. Wunsch,,Amanda M Wunsch,University of Washington,,,,Amanda M Wunsch,human,doctoral thesis,"doctoral thesis by Amanda M. Wunsch, 2016",University of Washington,2016,English,"ix, 106 pages ",,106,ix,"Ferguson, Susan M.(Susan Marie),degree supervisor.",Susan M.(Susan Marie) Ferguson,,,,http://hdl.handle.net/1773/37026,1773/37026,960819985
,Assessment of Hiv Prevention Needs of West Kenyan Adolescents: Implications For Intervention Adaptation,Assessment of Hiv Prevention Needs of West Kenyan Adolescents,Implications For Intervention Adaptation,Amelia S. Knopf,,Amy Knopf,Western Kentucky University,,,,Amy Knopf,human,doctoral thesis,"doctoral thesis by Amelia S. Knopf, 2013",University of Washington,2013,English,"x, 181 pages ",,181,x,"Thompson, Elaine Adams,1943-degree supervisor.",Elaine Adams Thompson,,,,http://hdl.handle.net/1773/24076,1773/24076,881125724
,Social Support Provision and Related Facilitators and Barriers in a Community Kitchen,Social Support Provision and Related Facilitators and Barriers in a Community Kitchen,,Kala Mayer,,Kala Mayer,,,,,Kala Mayer,human,doctoral thesis,"doctoral thesis by Kala Mayer, 2013",University of Washington,2013,English,"xii, 201 pages ",,201,xii,"Brown, Marie Annette,degree supervisor.",Marie Annette Brown,,,,http://hdl.handle.net/1773/25108,1773/25108,882482255
,The Process of Symptoms and Coping Strategies Experienced in the Prodromal Schizophrenia: A Grounded Theory,The Process of Symptoms and Coping Strategies Experienced in the Prodromal Schizophrenia,A Grounded Theory,Chieh Cheng,,Cheng Chieh,,,,,Cheng Chieh,human,doctoral thesis,"doctoral thesis by Chieh Cheng, 2017",University of Washington,2017,English,"viii, 91 pages ",,91,viii,"Schepp, Karen G.,degree supervisor.",Karen G. Schepp,,,,http://hdl.handle.net/1773/40435,1773/40435,1013578304
,"Adverse Childhood Experiences, Sleep, and Social Emotional Development Among Infants and Toddlers From Families Involved With Child Protective Services","Adverse Childhood Experiences, Sleep, and Social Emotional Development Among Infants and Toddlers From Families Involved With Child Protective Services",,Jonika B. Hash,,Jonika B Hash,,,,,Jonika B Hash,human,doctoral thesis,"doctoral thesis by Jonika B. Hash, 2018",University of Washington,2018,English,"vi, 134 pages ",,134,vi,"Oxford, Monica Lynn,degree supervisor.",Monica Lynn Oxford,,,,http://hdl.handle.net/1773/41716,1773/41716,1042090921
,"Stigma in Women Living With Hiv in Jakarta, Indonesia","Stigma in Women Living With Hiv in Jakarta, Indonesia",,Rita Ismail,,Rita Ismail,,,,,Rita Ismail,human,doctoral thesis,"doctoral thesis by Rita Ismail, 2014",University of Washington,2014,English,47 pages ,,47,,"Voss, Joachim G.,1964-degree supervisor.",Joachim G. Voss,,,,http://hdl.handle.net/1773/26392,1773/26392,896734945
,Itching and Parental Guilt: Parent Responses to Children's Symptoms Following Unintentional Burn Injuries,Itching and Parental Guilt,Parent Responses to Children's Symptoms Following Unintentional Burn Injuries,Yuting Lin,,Yuting Lin,Imperial College London,,,,Yuting Lin,human,doctoral thesis,"doctoral thesis by Yuting Lin, 2019",University of Washington,2019,English,"vi, 131 pages ",,131,vi,"Whitney, JoAnne D.(JoAnne Davis),1953-degree supervisor.",JoAnne D.(JoAnne Davis) Whitney,,,,http://hdl.handle.net/1773/43973,1773/43973,1114737465
,Evidence-based Public Health: Using Data Visualization For Improving the Understanding of Data and Information,Evidence-based Public Health,Using Data Visualization For Improving the Understanding of Data and Information,Seung Eun Park,,Seung Eun Park,,,,,Seung Eun Park,human,doctoral thesis,"doctoral thesis by Seung Eun Park, 2019",University of Washington,2019,English,"vi, 97 pages ",,97,vi,"Bekemeier, Elizabeth,1962-degree supervisor.",Elizabeth Bekemeier,,,,http://hdl.handle.net/1773/43947,1773/43947,1114484108
,Intergenerational Dialogue About Sexual Health and Hiv Prevention Among African American Women in Rural Mississippi,Intergenerational Dialogue About Sexual Health and Hiv Prevention Among African American Women in Rural Mississippi,,Gayle Robinson,,Gayle Robinson,,,,,Gayle Robinson,human,doctoral thesis,"doctoral thesis by Gayle Robinson, 2014",University of Washington,2014,English,"x, 107 pages ",,107,x,"Allen, David G.(David Gordon),1948-degree supervisor.",David G.(David Gordon) Allen,,,,http://hdl.handle.net/1773/27544,1773/27544,905655337
,Concept Analysis of Dispositional Humility in Professionals and Expanding the Understanding of the Concept in a Multidisciplinary Primary Care Environment: A Mixed Methods Study,Concept Analysis of Dispositional Humility in Professionals and Expanding the Understanding of the Concept in a Multidisciplinary Primary Care Environment,A Mixed Methods Study,Masa Sasagawa,,Masa Sasagawa,,,,,Masa Sasagawa,human,doctoral thesis,"doctoral thesis by Masa Sasagawa, 2018",University of Washington,2018,English,"x, 91 pages ",,91,x,"Kozuki, Yoriko,1958-degree supervisor.",Yoriko Kozuki,,,,http://hdl.handle.net/1773/42150,1773/42150,1077479563
,Maternal Prenatal Stress and Offspring Wheeze in Dyads Experiencing High Adversity,Maternal Prenatal Stress and Offspring Wheeze in Dyads Experiencing High Adversity,,Ashley Scherman,,Ashley Scherman,,,,,Ashley Scherman,human,doctoral thesis,"doctoral thesis by Ashley Scherman, 2017",University of Washington,2017,English,70 pages ,,70,,"Spieker, Susan Joan,1952-degree supervisor.",Susan Joan Spieker,,,,http://hdl.handle.net/1773/39846,1773/39846,1003325750
,Exploring Factors That Influence Adoption and Implementation of the Baby-friendly Hospital Initiative in Washington State,Exploring Factors That Influence Adoption and Implementation of the Baby-friendly Hospital Initiative in Washington State,,Kayla Bell,,Kayla Bell,University of Worcester,,,Kayla Bell,,human,master's thesis,"master's thesis by Kayla Bell, 2016",University of Washington,2016,English,33 pages ,,33,,"Johnson, Donna Bray,degree supervisor.",Donna Bray Johnson,,,,http://hdl.handle.net/1773/38184,1773/38184,983466370
,The Association Between Access to Water and Sugary-sweetened Beverage Consumption in 37 Schools in King County,The Association Between Access to Water and Sugary-sweetened Beverage Consumption in 37 Schools in King County,,Sepideh Dibay Moghadam,,Sepideh Dibay Moghadam,,,,Sepideh Dibay Moghadam,,human,master's thesis,"master's thesis by Sepideh Dibay Moghadam, 2013",University of Washington,2013,English,"iii, 33 pages ",,33,iii,"Johnson, Donna Bray,degree supervisor.",Donna Bray Johnson,,,,http://hdl.handle.net/1773/23399,1773/23399,878081713
,Association Between Objective Measurement of Walking Activity and Neighborhood Walkability,Association Between Objective Measurement of Walking Activity and Neighborhood Walkability,,Liang-Dar Hwang,,Liang-Dar Hwang,,,,Liang-Dar Hwang,,human,master's thesis,"master's thesis by Liang-Dar Hwang, 2014",University of Washington,2014,English,27 pages ,,27,,"Duncan, Glen E.,degree supervisor.",Glen E. Duncan,,,,http://hdl.handle.net/1773/25448,1773/25448,890941739
,The Effect of Fructose Vs. Glucose Beverages On Low-grade Systemic Inflammation,The Effect of Fructose Vs. Glucose Beverages On Low-grade Systemic Inflammation,,Jessica N. Kuzma,,Jessica N Kuzma,,,,,Jessica N Kuzma,human,doctoral thesis,"doctoral thesis by Jessica N. Kuzma, 2016",University of Washington,2016,English,"v, 82 pages",,82,v,"Kratz, Mario,degree supervisor.",Mario Kratz,,,,http://hdl.handle.net/1773/36796,1773/36796,958383588
,The Association Between Vitamin K₂ Intake and Glucose Homeostasis in Individuals With and Without Chronic Kidney Disease,The Association Between Vitamin K₂ Intake and Glucose Homeostasis in Individuals With and Without Chronic Kidney Disease,,Hsin-Hui Tseng,,Hui-Hsin Tseng,,,,Hui-Hsin Tseng,,human,master's thesis,"master's thesis by Hsin-Hui Tseng, 2016",University of Washington,2016,English,"viii, 101 pages ",,101,viii,"Kratz, Mario,degree supervisor.;De Boer, Ian H.,degree supervisor.",Mario Kratz, Ian H. De Boer,,,http://hdl.handle.net/1773/37208,1773/37208,972349851
,The Impact of Low-fat and Full-fat Dairy Consumption On Metabolic Health: A Randomized Dietary Intervention Trial,The Impact of Low-fat and Full-fat Dairy Consumption On Metabolic Health,A Randomized Dietary Intervention Trial,Kelsey A. Schmidt,,Kelsey A Schmidt,,,,,Kelsey A Schmidt,human,doctoral thesis,"doctoral thesis by Kelsey A. Schmidt, 2020",University of Washington,2020,English,"ix, 151, xxx pages ",,151,xxxix,"Kratz, Mario,degree supervisor.",Mario Kratz,,,,http://hdl.handle.net/1773/46140,1773/46140,1196250681
,Estimation of Inherent Optical Properties and Phytoplankton Community Structure From Hyperspectral In-water Radiometry,Estimation of Inherent Optical Properties and Phytoplankton Community Structure From Hyperspectral In-water Radiometry,,Eric C. Rehm,,Eric Rehm,University of Washington,,,,Eric Rehm,human,doctoral thesis,"doctoral thesis by Eric C. Rehm, 2013",University of Washington,2013,English,"vi, 196 pages ",,196,vi,"D'Asaro, Eric Arthur,degree supervisor.",Eric Arthur D'Asaro,,,,http://hdl.handle.net/1773/23323,1773/23323,890607095
,The Biogeochemistry of Particulate Trace Elements and Isotopes in the North Atlantic Ocean,The Biogeochemistry of Particulate Trace Elements and Isotopes in the North Atlantic Ocean,,Pamela M. Barrett,,Pamela M Barrett,,,,,Pamela M Barrett,human,doctoral thesis,"doctoral thesis by Pamela M. Barrett, 2015",University of Washington,2015,English,136 pages ,,136,,"Resing, Joseph A.(Joseph Anton),degree supervisor.",Joseph A.(Joseph Anton) Resing,,,,http://hdl.handle.net/1773/35284,1773/35284,947723654
Quantifying the deep: the importance of diagenetic reactions to marine geochemical cycles,,Quantifying the Deep,The Importance of Diagenetic Reactions to Marine Geochemical Cycles,Richard David Berg,,Richard David Berg,University of Washington,,,,Richard David Berg,human,doctoral thesis,"doctoral thesis by Richard David Berg, 2018",University of Washington,2018,English,"vii, 141 pages ",,141,vii,"Solomon, Evan A.,degree supervisor.",Evan A. Solomon,,,,http://hdl.handle.net/1773/43434,1773/43434,1091058856
,Seas in Hot Water: Marine Heatwaves On the Move : Following the Heat,Seas in Hot Water,Marine Heatwaves On the Move : Following the Heat,Hillary A. Scannell,,Hillary A Scannell,,,,,Hillary A Scannell,human,doctoral thesis,"doctoral thesis by Hillary A. Scannell, 2020",University of Washington,2020,English,"1 page, vii, 127 pages ",,128,vii,"Thompson, LuAnne,degree supervisor.",LuAnne Thompson,,,,http://hdl.handle.net/1773/46867,1773/46867,1253401983
,Transport Effects On Coastal Productivity and Harmful Algal Blooms,Transport Effects On Coastal Productivity and Harmful Algal Blooms,,Hally B. Stone,,Hally B Stone,,,,,Hally B Stone,human,doctoral thesis,"doctoral thesis by Hally B. Stone, 2020",University of Washington,2020,English,"2 pages, xi, 165 pages, 1 page ",,168,xi,"Banas, Neil S.,degree supervisor.;MacCready, Parker,degree supervisor.",Neil S. Banas, Parker MacCready,,,http://hdl.handle.net/1773/46534,1773/46534,1246318241
,Elucidation of Group B Streptococcus Hemolytic Pigment and Hyaluronidase During Infection,Elucidation of Group B Streptococcus Hemolytic Pigment and Hyaluronidase During Infection,,Blair Armistead,,Blair Armistead,,,,,Blair Armistead,human,doctoral thesis,"doctoral thesis by Blair Armistead, 2020",University of Washington,2020,English,"xi, 224 pages ",,224,xi,"Rajagopal, Lakshmi,degree supervisor.",Lakshmi Rajagopal,,,,http://hdl.handle.net/1773/45411,1773/45411,1153269777
,Innate Immune Consequences of Hepatocyte Injury,Innate Immune Consequences of Hepatocyte Injury,,Katherine J. Brempelis,,Katherine J Brempelis,,,,,Katherine J Brempelis,human,doctoral thesis,"doctoral thesis by Katherine J. Brempelis, 2016",University of Washington,2016,English,"ix, 137 pages ",,137,ix,"Crispe, Ian N.,degree supervisor.",Ian N. Crispe,,,,http://hdl.handle.net/1773/35509,1773/35509,948518790
,The Kinetics of Myeloid Derived Suppressor Cell Frequency and Function in Chronic Retroviral Infections,The Kinetics of Myeloid Derived Suppressor Cell Frequency and Function in Chronic Retroviral Infections,,Sandra Dross,,Sandra E Dross,University of Washington,,,,Sandra E Dross,human,doctoral thesis,"doctoral thesis by Sandra Dross, 2016",University of Washington,2016,English,92 pages ,,92,,"Horton, Helen(Medical scientist),degree supervisor.",Helen(Medical scientist) Horton,,,,http://hdl.handle.net/1773/36801,1773/36801,958383756
,Control of Innate Antiviral Immunity By Hiv-1,Control of Innate Antiviral Immunity By Hiv-1,,Arjun Rustagi,,Arjun Rustagi,University of Washington School of Medicine,,,,Arjun Rustagi,human,doctoral thesis,"doctoral thesis by Arjun Rustagi, 2013",University of Washington,2013,English,"xvi, 116 pages ",,116,xvi,"Gale, Michael,Jr.,degree supervisor.",Michael Gale,,,,http://hdl.handle.net/1773/24193,1773/24193,881463152
,Mechanisms of Group B Streptococcus Colonization and Ascending Infection,Mechanisms of Group B Streptococcus Colonization and Ascending Infection,,Jay Vornhagen,,Jay Vornhagen,University of Washington,,,,Jay Vornhagen,human,doctoral thesis,"doctoral thesis by Jay Vornhagen, 2017",University of Washington,2017,English,"xi, 206 pages ",,206,xi,"Rajagopal, Lakshmi,degree supervisor.",Lakshmi Rajagopal,,,,http://hdl.handle.net/1773/40282,1773/40282,1007778837
,Determinants of Flaviviral Neuropathology,Determinants of Flaviviral Neuropathology,,Kathryn McGuckin Wuertz,,Kathryn McGuckin Wuertz,,,,,Kathryn McGuckin Wuertz,human,doctoral thesis,"doctoral thesis by Kathryn McGuckin Wuertz, 2019",University of Washington,2019,English,"xii, 148 pages ",,148,xii,"Gale, Michael,Jr.,degree supervisor.",Michael Gale,,,,http://hdl.handle.net/1773/43612,1773/43612,1101179475
