existingItemLabel,newItemLabel,title,subtitle,statedAs,statedAsCreator2,creator,educated at,creatorNew,creatorNew2,CreatorMastersReconciled,creatorDoctoralReconciled,instance of,genre,Den,submittedTo,inception,language,pages,Leaf,page,RomanNumberedPage,degreeSupervisor,degreeSupervisor 1,degreeSupervisor 2,degreeSupervisor 3,degreeSupervisor 4,hdlURI,hdl,OCLCID
,Braiding Language (by Computer): Lushootseed Grammar Engineering,Braiding Language (by Computer),Lushootseed Grammar Engineering,Joshua Crowgey,,Joshua Crowgey,University of Washington,,,,Joshua Crowgey,human,doctoral thesis,"doctoral thesis by Joshua Crowgey, 2019",University of Washington,2019,English,"x, 419 pages ",,419,x,"Bender, Emily M.,1973-degree supervisor.http://www.wikidata.org/entity/Q33122366",Q33122366,,,,http://hdl.handle.net/1773/45218,1773/45218,1142816444
,Semantic Operations For Transfer-based Machine Translation,Semantic Operations For Transfer-based Machine Translation,,Michael Wayne Goodman,,Michael Wayne Goodman,University of Washington,,,,Michael Wayne Goodman,human,doctoral thesis,"doctoral thesis by Michael Wayne Goodman, 2018",University of Washington,2018,English,"xxiv, 251 pages ",,251,xxiv,"Bender, Emily M.,1973-degree supervisor.http://www.wikidata.org/entity/Q33122366;Bond, Francis,1967-degree supervisor.http://www.wikidata.org/entity/Q51955919",Q33122366,http://www.wikidata.org/entity/Q51955919,,,http://hdl.handle.net/1773/42432,1773/42432,1078786794
,Inferring Grammars From Interlinear Glossed Text: Extracting Typological and Lexical Properties For the Automatic Generation of Hpsg Grammars,Inferring Grammars From Interlinear Glossed Text,Extracting Typological and Lexical Properties For the Automatic Generation of Hpsg Grammars,Kristen Howell,,Kristen Howell,University of Washington,,,,Kristen Howell,human,doctoral thesis,"doctoral thesis by Kristen Howell, 2020",University of Washington,2020,English,"viii, 169 pages ",,169,viii,"Bender, Emily M.,1973-degree supervisor.http://www.wikidata.org/entity/Q33122366",Q33122366,,,,http://hdl.handle.net/1773/46080,1773/46080,1196833566
,Multi-predicate Constructions in Nuuchahnulth,Multi-predicate Constructions in Nuuchahnulth,,David Inman,,David Inman,University of Washington,,,,David Inman,human,doctoral thesis,"doctoral thesis by David Inman, 2019",University of Washington,2019,English,"ix, 221 pages ",,221,ix,"Bender, Emily M.,1973-degree supervisor.http://www.wikidata.org/entity/Q33122366",Q33122366,,,,http://hdl.handle.net/1773/44841,1773/44841,1129599450
,The Suitability of Generative Adversarial Training For Bert Natural Language Generation,The Suitability of Generative Adversarial Training For Bert Natural Language Generation,,Benny Longwill,,Benny Longwill,University of Washington,,,Benny Longwill,,human,master's thesis,"master's thesis by Benny Longwill, 2020",University of Washington,2020,English,"v, 37 pages ",,37,v,"Steinert-Threlkeld, Shane,degree supervisor. 1= http://www.wikidata.org/entity/Q59749199.",Q59749199.,,,,http://hdl.handle.net/1773/46830,1773/46830,1260220889
,An Analysis of Gender Bias in K-12 Assigned Literature Through Comparison of Non-contextual Word Embedding Models,An Analysis of Gender Bias in K-12 Assigned Literature Through Comparison of Non-contextual Word Embedding Models,,Preeti Mohan,,Preeti Mohan,University of Washington,,,Preeti Mohan,,human,master's thesis,"master's thesis by Preeti Mohan, 2021",University of Washington,2021,English,"vi, 75 pages ",,75,vi,"Bender, Emily M.,1973-degree supervisor.http://www.wikidata.org/entity/Q33122366",Q33122366,,,,http://hdl.handle.net/1773/46827,1773/46827,1260220751
,Modeling Adnominal Possession in the Lingo Grammar Matrix,Modeling Adnominal Possession in the Lingo Grammar Matrix,,Elizabeth Nielsen,,Elizabeth Nielsen,University of Washington,,,Elizabeth Nielsen,,human,master's thesis,"master's thesis by Elizabeth Nielsen, 2018",University of Washington,2018,English,"iii, 120 pages ",,120,iii,"Bender, Emily M.,1973-degree supervisor.http://www.wikidata.org/entity/Q33122366",Q33122366,,,,http://hdl.handle.net/1773/42433,1773/42433,1078786779
,A Finite-state Morphological Analyzer For Central Alaskan Yup'ik,A Finite-state Morphological Analyzer For Central Alaskan Yup'ik,,Lonny Alaskuk Strunk,,Lonny Alaskuk Strunk,University of Washington,,,Lonny Alaskuk Strunk,,human,master's thesis,"master's thesis by Lonny Alaskuk Strunk, 2020",University of Washington,2020,English,"1 page, vii, 134 pages ",,135,vii,"Bender, Emily M.,1973-degree supervisor.http://www.wikidata.org/entity/Q33122366",Q33122366,,,,http://hdl.handle.net/1773/46496,1773/46496,1249449246
,Addressing Cross-scale Governance in the Alignment of Marine Fisheries Harvest and Conservation Objectives Within a U.S. Community,Addressing Cross-scale Governance in the Alignment of Marine Fisheries Harvest and Conservation Objectives Within a U.S. Community,,Stephen Copps,,Stephen Copp,,,,Stephen Copp,,human,master's thesis,"master's thesis by Stephen Copps, 2012",University of Washington,2012,English,31 pages,,31,,"Klinger, Terrie,1956-thesis advisor.",Terrie Klinger,,,,http://hdl.handle.net/1773/20851,1773/20851,823874070
,Adequacy of Federal Marine Salvage Policy in the United States,Adequacy of Federal Marine Salvage Policy in the United States,,David Alexander Hess,,David Hess,,,,David Hess,,human,master's thesis,"master's thesis by David Alexander Hess, 2013",University of Washington,2013,English,23 pages,,23,,"Leschine, Thomas M.,degree supervisor.",Thomas M. Leschine,,,,http://hdl.handle.net/1773/23499,1773/23499,879229037
Implementing collaborative community-based conservation by applying stewardship contracting in coastal marine systems,,Implementing Collaborative Community-based Conservation By Applying Stewardship Contracting in Coastal Marine Systems,,Cullen D. Brady,,Cullen D. Brady,University of Washington,,,Cullen D. Brady,,human,master's thesis,"master's thesis by Cullen D. Brady, 2018",University of Washington,2018,English,39 pages,,39,,"Kelly, Ryan P.(Ryan Patrick),degree supervisor.",Ryan P.(Ryan Patrick) Kelly,,,,http://hdl.handle.net/1773/43407,1773/43407,1091060167
"Preliminary cost and economic performance assessment of utility-scale solar photovoltaics at the Snohomish County, Washington's Tulalip Tribes' Big Flats site",,"Preliminary Cost and Economic Performance Assessment of Utility-scale Solar Photovoltaics At the Snohomish County, Washington's Tulalip Tribes' ""big Flats"" Site",,Kiersten Dallstream,,Kiersten Dallstream,University of Washington,,,Kiersten Dallstream,,human,master's thesis,"master's thesis by Kiersten Dallstream, 2018",University of Washington,2018,English,59 pages ,,59,,"Christie, Patrick,degree supervisor.",Patrick Christie,,,,http://hdl.handle.net/1773/43088,1773/43088,1085678552
Effects of high temperature exposure on early reproductive development in monosex female sablefish (Anoplopoma fimbria),,Effects of High Temperature Exposure On Early Reproductive Development in Monosex Female Sablefish (anoplopoma Fimbria),,Thao B. Huynh,,Thao B. Huynh,University of Washington,,,Thao B. Huynh,,human,master's thesis,"master's thesis by Thao B. Huynh, 2018",University of Washington,2018,English,43 pages ,,43,,"Allison, E. H.(Edward Hugh),degree supervisor.",E. H.(Edward Hugh) Allison,,,,http://hdl.handle.net/1773/42436,1773/42436,1081042855
"Anthrozoology, Anthropomorphism, and Marine Conservation: A Case Study of Southern Resident Killer Whale, Tahlequah, and Her Tour of Grief",,"Anthrozoology, Anthropomorphism, and Marine Conservation","A Case Study of Southern Resident Killer Whale, Tahlequah, and Her Tour of Grief",Jessica M. Knoth,,Jessica Knoth,University of Washington,,,Jessica Knoth,,human,master's thesis,"master's thesis by Jessica M. Knoth, 2019",University of Washington,2019,English,91 pages ,,91,,"Miller, Marc L.,degree supervisor.",Marc L. Miller,,,,http://hdl.handle.net/1773/44355,1773/44355,1124768394
Temperature anomalies in the Olympic Coast National Marine Sanctuary and the influence of winds and currents during the 2013-2014 northeast Pacific marine heat wave and 2015 El Niño,,Temperature Anomalies in the Olympic Coast National Marine Sanctuary and the Influence of Winds and Currents During the 2013-2014 Northeast Pacific Marine Heat Wave and 2015 El Niño,,Julie Ann Koehlinger,,Julie Ann Koehlinger,University of Washington,,,Julie Ann Koehlinger,,human,master's thesis,"master's thesis by Julie Ann Koehlinger, 2018",University of Washington,2018,English,25 pages ,,25,,"Klinger, Terrie,1956-degree supervisor.",Terrie Klinger,,,,http://hdl.handle.net/1773/42443,1773/42443,1082146113
"Algal Neurotoxins in Pink Salmon (Oncorhynchus gorbuscha) from Icy Strait and Icy Point, Alaska",,"Algal Neurotoxins in Pink Salmon (oncorhynchus Gorbuscha) From Icy Strait and Icy Point, Alaska",,Spencer Showalter,,Spencer Showalter,University of Washington,,,Spencer Showalter,,human,master's thesis,"master's thesis by Spencer Showalter, 2019",University of Washington,2019,English,20 pages ,,20,,"Klinger, Terrie,1956-degree supervisor.",Terrie Klinger,,,,http://hdl.handle.net/1773/43708,1773/43708,1101624227
Fishing for market solutions: measuring the global performance of fishery improvement projects,,Fishing For Market Solutions,Measuring the Global Performance of Fishery Improvement Projects,Karen T. Villeda,,Karen T. Villeda,University of Washington,,,Karen T. Villeda,,human,master's thesis,"master's thesis by Karen T. Villeda, 2018",University of Washington,2018,English,"iv, 37 pages ",,37,iv,"Allison, E. H.(Edward Hugh),degree supervisor.",E. H.(Edward Hugh) Allison,,,,http://hdl.handle.net/1773/43084,1773/43084,1085677291
Tracking the trade of octopus across east Africa and onto the global market- challenges to marine stewardship council certification ambitions,,Tracking the Trade of Octopus Across East Africa and Onto the Global Market- Challenges to Marine Stewardship Council Certification Ambitions,,Lily Z. Zhao,,Lily Z. Zhao,University of Washington,,,Lily Z. Zhao,,human,master's thesis,"master's thesis by Lily Z. Zhao, 2018",University of Washington,2018,English,27 pages ,,27,,"Allison, E. H.(Edward Hugh),degree supervisor.",E. H.(Edward Hugh) Allison,,,,http://hdl.handle.net/1773/43086,1773/43086,1085678251
,Spatial Foraging Patterns in Puget Sound Pigeon Guillemot (cepphus Columba): An Investigation Using Stable Isotopes and Community Science,Spatial Foraging Patterns in Puget Sound Pigeon Guillemot (cepphus Columba),An Investigation Using Stable Isotopes and Community Science,Emily Buckner,,Emily V Buckner,Carleton College,,,Emily V Buckner,,human,master's thesis,"master's thesis by Emily Buckner, 2020",University of Washington,2020,English,23 pages ,,23,,"Klinger, Terrie,1956-degree supervisor.",Terrie Klinger,,,,http://hdl.handle.net/1773/46083,1773/46083,1196833379
,Experiencing Tentacle Difficulties? Swot It Out! a Swot Analysis On the Giant Pacific Octopus Marine Conservation Tourism Programs At the Seattle Aquarium,Experiencing Tentacle Difficulties? Swot It Out! a Swot Analysis On the Giant Pacific Octopus Marine Conservation Tourism Programs At the Seattle Aquarium,,Manjari Misra,,Manjari Misra,University of Washington,,,Manjari Misra,,human,master's thesis,"master's thesis by Manjari Misra, 2020",University of Washington,2020,English,174 pages ,,174,,"Miller, Marc L.,degree supervisor.",Marc L. Miller,,,,http://hdl.handle.net/1773/46095,1773/46095,1196830961
,"Anthrozoology and Public Perception: Humans and Great White Sharks (carchardon Carcharias) On Cape Cod, Massachusetts, Usa",Anthrozoology and Public Perception,"Humans and Great White Sharks (carchardon Carcharias) On Cape Cod, Massachusetts, Usa",Jessica O'Toole,,Jessica O'Toole,,,,Jessica O'Toole,,human,master's thesis,"master's thesis by Jessica O'Toole, 2020",University of Washington,2020,English,110 pages ,,110,,"Miller, Marc L.,degree supervisor.",Marc L. Miller,,,,http://hdl.handle.net/1773/46087,1773/46087,1196831623
,"The Dichotomous Perceptions of Marine Debris in Miyako, Okinawa Prefecture, Japan","The Dichotomous Perceptions of Marine Debris in Miyako, Okinawa Prefecture, Japan",,Karin Tiffany Otsuka,,Karin Tiffany Otsuka,University of Washington,,,Karin Tiffany Otsuka,,human,master's thesis,"master's thesis by Karin Tiffany Otsuka, 2020",University of Washington,2020,English,110 pages ,,110,,"Ota, Yoshitaka,degree supervisor.",Yoshitaka Ota,,,,http://hdl.handle.net/1773/46094,1773/46094,1196831403
,Magnetic Particle Imaging (mpi) Tracers For in Vivo Applications,Magnetic Particle Imaging (mpi) Tracers For in Vivo Applications,,Hamed Arami,,Hamed Arami,,,,,Hamed Arami,human,doctoral thesis,"doctoral thesis by Hamed Arami, 2015",University of Washington,2015,English,295 pages ,,295,,"Krishnan, Kannan M.,degree supervisor.",Kannan M. Krishnan,,,,http://hdl.handle.net/1773/35245,1773/35245,947719696
,Molecular Recognition of Solids By Peptides: Surface Phenomena and Mechanisms of Self-assembly,Molecular Recognition of Solids By Peptides,Surface Phenomena and Mechanisms of Self-assembly,Christopher R. So,,Christopher R. So,,,,,Christopher R. So,human,doctoral thesis,"doctoral thesis by Christopher R. So, 2012",University of Washington,2012,English,"vi, 146 pages ",,146,vi,"Sarikaya, Mehmet,thesis advisor.",Mehmet Sarikaya,,,,http://hdl.handle.net/1773/20294,1773/20294,812910056
,Inertial Electrostatic Confinement (iec) Device As Plasma Injection Source,Inertial Electrostatic Confinement (iec) Device As Plasma Injection Source,,Zefeng Yu,,Zefeng Yu,,,,Zefeng Yu,,human,master's thesis,"master's thesis by Zefeng Yu, 2015",University of Washington,2015,English,30 pages ,,30,,"Ohuchi, Fumio S.,1948-degree supervisor.",Fumio S. Ohuchi,,,,http://hdl.handle.net/1773/35248,1773/35248,947720082
,Optics and Optoelectronics of Atomically Thin Magnets and Semiconductors,Optics and Optoelectronics of Atomically Thin Magnets and Semiconductors,,Genevieve Clark,,Genevieve Clark Thomson,,,,,Genevieve Clark Thomson,human,doctoral thesis,"doctoral thesis by Genevieve Clark, 2018",University of Washington,2018,English,104 pages ,,104,,"Xu, Xiaodong(Physicist),degree supervisor.",Xiaodong(Physicist) Xu,,,,http://hdl.handle.net/1773/43091,1773/43091,1085679696
,Vanadyl Ethylene Glycolate For Aqueous Zinc-ion Batteries With High Rate Capability and Ultralong Cycling Stability,Vanadyl Ethylene Glycolate For Aqueous Zinc-ion Batteries With High Rate Capability and Ultralong Cycling Stability,,Xiaoxiao Jia,,Xiaoxiao Jiao,,,,Xiaoxiao Jiao,,human,master's thesis,"master's thesis by Xiaoxiao Jia, 2019",University of Washington,2019,English,35 pages ,,35,,"Cao, Guozhong,degree supervisor.",Guozhong Cao,,,,http://hdl.handle.net/1773/43713,1773/43713,1101625035
,Chalcogenide Materials For Renewable Energy Applications,Chalcogenide Materials For Renewable Energy Applications,,Olivia M. Lenz,,Olivia M Lenz,,,,,Olivia M Lenz,human,doctoral thesis,"doctoral thesis by Olivia M. Lenz, 2017",University of Washington,2017,English,"x, 94 pages ",,94,x,"Krishnan, Kannan M.,degree supervisor.",Kannan M. Krishnan,,,,http://hdl.handle.net/1773/40629,1773/40629,1020407155
,"Electrocatalytic Effects of (zr, Ti, Mo)-doped Niobium Pentoxide Nanocrystal Impregnated Carbon Felt For Vanadium Redox Flow Batteries","Electrocatalytic Effects of (zr, Ti, Mo)-doped Niobium Pentoxide Nanocrystal Impregnated Carbon Felt For Vanadium Redox Flow Batteries",,Keith Steele,,Keith Steele,,,,Keith Steele,,human,master's thesis,"master's thesis by Keith Steele, 2018",University of Washington,2018,English,"vi, 60 pages ",,60,vi,"Cao, Guozhong,degree supervisor.",Guozhong Cao,,,,http://hdl.handle.net/1773/42450,1773/42450,1078701394
,Interface Engineering to Enhance the Mechanical Performance of Aluminum Thin Film Deposited On Pet Substrate,Interface Engineering to Enhance the Mechanical Performance of Aluminum Thin Film Deposited On Pet Substrate,,Koichiro Tanaka,,Koichiro Tanaka,,,,Koichiro Tanaka,,human,master's thesis,"master's thesis by Koichiro Tanaka, 2020",University of Washington,2020,English,84 pages ,,84,,"Wang, Junlan,1971-degree supervisor.",Junlan Wang,,,,http://hdl.handle.net/1773/46499,1773/46499,1245426282
,Intracellular Dynamics of Superparamagnetic Iron Oxide Nanoparticles For Magnetic Particle Imaging,Intracellular Dynamics of Superparamagnetic Iron Oxide Nanoparticles For Magnetic Particle Imaging,,Eric Teeman,,Eric Teeman,,,,,Eric Teeman,human,doctoral thesis,"doctoral thesis by Eric Teeman, 2019",University of Washington,2019,English,"xiii, 2017 pages ",,2017,xiii,"Krishnan, Kannan M.,degree supervisor.",Kannan M. Krishnan,,,,http://hdl.handle.net/1773/44364,1773/44364,1125008381
,Finite-difference Methods For the Wave Equation With Reduced Dispersion Errors,Finite-difference Methods For the Wave Equation With Reduced Dispersion Errors,,Yajun An,,Yajun An,University of Washington,,,Yajun An,,human,master's thesis,"master's thesis by Yajun An, 2012",University of Washington,2012,English,,,,,"Bube, Kenneth P.,thesis advisor.",Kenneth P. Bube,,,,http://hdl.handle.net/1773/22605,1773/22605,875017685
,Wild Automorphisms and Abelian Varieties,Wild Automorphisms and Abelian Varieties,,Antonio Kirson,,Antonio Kirson,University of Washington,,,,Antonio Kirson,human,doctoral thesis,"doctoral thesis by Antonio Kirson, 2010",University of Washington,2010,English,"iv, 37 pages",,37,iv,"Kovács, Sándor J.(Sándor József),degree supervisor.",Sándor J.(Sándor József) Kovács,,,,http://hdl.handle.net/1773/15907,1773/15907,949895725
,Local Cohomology At Generic Singularities of Schubert Varieties in Cominuscule Flag Varieties,Local Cohomology At Generic Singularities of Schubert Varieties in Cominuscule Flag Varieties,,Sweta Suryanarayan,,Sweta Suryanarayan,University of Washington,,,,Sweta Suryanarayan,human,doctoral thesis,"doctoral thesis by Sweta Suryanarayan, 2012",University of Washington,2012,English,"vii, 91 pages ",,91,vii,"Mitchell, Stephen A.(Stephen Ames),thesis advisor.",Stephen A.(Stephen Ames) Mitchell,,,,http://hdl.handle.net/1773/20907,1773/20907,826756630
,Hopf Algebras of Finite Gelfand-kirillov Dimension,Hopf Algebras of Finite Gelfand-kirillov Dimension,,Guangbin Zhuang,,Guangbin Zhuang,University of Washington,,,,Guangbin Zhuang,human,doctoral thesis,"doctoral thesis by Guangbin Zhuang, 2013",University of Washington,2013,English,"iv, 143 pages",,143,iv,"Zhang, James(James J.),degree supervisor.",James(James J.) Zhang,,,,http://hdl.handle.net/1773/24328,1773/24328,881732318
,Finite-difference Methods For Second-order Wave Equations With Reduced Dispersion Errors,Finite-difference Methods For Second-order Wave Equations With Reduced Dispersion Errors,,Yajun An,,Yajun An,University of Washington,,,,Yajun An,human,doctoral thesis,"doctoral thesis by Yajun An, 2015",University of Washington,2015,English,"vi, 96 pages ",,96,vi,"Bube, Kenneth P.,degree supervisor.",Kenneth P. Bube,,,,http://hdl.handle.net/1773/34018,1773/34018,936211012
,"Brownian Particles Interacting With a Newtonian Barrier: Skorohod Maps and Their Use in Solving a Pde With Free Boundary, Strong Approximation, and Hydrodynamic Limits",Brownian Particles Interacting With a Newtonian Barrier,"Skorohod Maps and Their Use in Solving a Pde With Free Boundary, Strong Approximation, and Hydrodynamic Limits",Clayton Barnes,,Clayton Barnes,University of Washington,,,,Clayton Barnes,human,doctoral thesis,"doctoral thesis by Clayton Barnes, 2018",University of Washington,2018,English,"viii, 149 pages  ",,149,viii,"Burdzy, K.(Krzysztof),degree supervisor.",K.(Krzysztof) Burdzy,,,,http://hdl.handle.net/1773/43094,1773/43094,1085680933
,On the Duflot Filtration For Equivariant Cohomology Rings,On the Duflot Filtration For Equivariant Cohomology Rings,,James Cunningham Cameron,,James Cunningham Cameron,University of Washington,,,,James Cunningham Cameron,human,doctoral thesis,"doctoral thesis by James Cunningham Cameron, 2018",University of Washington,2018,English,"iv, 93 pages ",,93,iv,"Palmieri, John H.(John Harold),1964-degree supervisor.;Pevtsova, Julia,degree supervisor.",John H.(John Harold) Palmieri, Julia Pevtsova,,,http://hdl.handle.net/1773/42460,1773/42460,1078700867
,Towards a Non-q-gorenstein Minimal Model Program,Towards a Non-q-gorenstein Minimal Model Program,,Alberto Chiecchio,,Alberto Chiecchio,University of Washington,,,,Alberto Chiecchio,human,doctoral thesis,"doctoral thesis by Alberto Chiecchio, 2014",University of Washington,2014,English,108 pages ,,108,,"Kovács, Sándor J.(Sándor József),degree supervisor.",Sándor J.(Sándor József) Kovács,,,,http://hdl.handle.net/1773/26122,1773/26122,898992845
,Grothendieck Duality On Diagrams of Schemes,Grothendieck Duality On Diagrams of Schemes,,Graham Clenaghan,,Graham Clenaghan,University of Washington,,,,Graham Clenaghan,human,doctoral thesis,"doctoral thesis by Graham Clenaghan, 2015",University of Washington,2015,English,"i, 45 pages ",,45,i,"Kovács, Sándor J.(Sándor József),degree supervisor.",Sándor J.(Sándor József) Kovács,,,,http://hdl.handle.net/1773/35250,1773/35250,947720281
,Shimura Degrees For Elliptic Curves Over Number Fields,Shimura Degrees For Elliptic Curves Over Number Fields,,Alyson Deines,,Alyson Deines,University of Washington,,,,Alyson Deines,human,doctoral thesis,"doctoral thesis by Alyson Deines, 2014",University of Washington,2014,English,"v, 100 pages ",,100,v,"Stein, William A.,1974-degree supervisor.",William A. Stein,,,,http://hdl.handle.net/1773/26527,1773/26527,894137079
,Projective Geometry For Perfectoid Spaces,Projective Geometry For Perfectoid Spaces,,Gabriel Dorfsman-Hopkins,,Gabriel Dorfsman-Hopkins,University of Washington,,,,Gabriel Dorfsman-Hopkins,human,doctoral thesis,"doctoral thesis by Gabriel Dorfsman-Hopkins, 2019",University of Washington,2019,English,"v, 136 pages ",,136,v,"Lieblich, Max,1978-degree supervisor.",Max Lieblich,,,,http://hdl.handle.net/1773/44374,1773/44374,1125013304
,Self-shrinking Solutions to Mean Curvature Flow,Self-shrinking Solutions to Mean Curvature Flow,,Gregory Drugan,,Gregory Drugan,University of Washington,,,,Gregory Drugan,human,doctoral thesis,"doctoral thesis by Gregory Drugan, 2014",University of Washington,2014,English,"v, 111 pages ",,111,v,"Yuan, Yu(Mathematician),degree supervisor.",Yu(Mathematician) Yuan,,,,http://hdl.handle.net/1773/26529,1773/26529,894264668
,Some Theorems On the Resolution Property and the Brauer Map,Some Theorems On the Resolution Property and the Brauer Map,,Siddharth Mathur,,Siddharth Mathur,University of Washington,,,,Siddharth Mathur,human,doctoral thesis,"doctoral thesis by Siddharth Mathur, 2018",University of Washington,2018,English,"v, 87 pages ",,87,v,"Lieblich, Max,1978-degree supervisor.",Max Lieblich,,,,http://hdl.handle.net/1773/42453,1773/42453,1078701390
,Alternate Approaches to the Cup Product and Gerstenhaber Bracket On Hochschild Cohomology,Alternate Approaches to the Cup Product and Gerstenhaber Bracket On Hochschild Cohomology,,Cris Negron,,Cris Negron,University of Washington,,,,Cris Negron,human,doctoral thesis,"doctoral thesis by Cris Negron, 2015",University of Washington,2015,English,"v, 178 pages ",,178,v,"Zhang, James(James J.),degree supervisor.",James(James J.) Zhang,,,,http://hdl.handle.net/1773/34023,1773/34023,936211002
,Results On Singularities of Pairs,Results On Singularities of Pairs,,Lorenzo Prelli,,Lorenzo Prelli,University of Washington,,,,Lorenzo Prelli,human,doctoral thesis,"doctoral thesis by Lorenzo Prelli, 2016",University of Washington,2016,English,"iii, 62 pages",,62,iii,"Kovács, Sándor J.(Sándor József),degree supervisor.",Sándor J.(Sándor József) Kovács,,,,http://hdl.handle.net/1773/36752,1773/36752,958021144
,Topics in Continuum Theory,Topics in Continuum Theory,,John Samples,,John Samples,,,,John Samples,,human,master's thesis,"master's thesis by John Samples, 2017",University of Washington,2017,English,93 pages ,,93,,"Bube, Kenneth P.,degree supervisor.",Kenneth P. Bube,,,,http://hdl.handle.net/1773/40931,1773/40931,1037021823
,Abelian Varieties With Small Isogeny Class and Applications to Cryptography,Abelian Varieties With Small Isogeny Class and Applications to Cryptography,,Travis Scholl,,Travis Scholl,University of Washington,,,,Travis Scholl,human,doctoral thesis,"doctoral thesis by Travis Scholl, 2018",University of Washington,2018,English,"iv, 108 pages ",,108,iv,"Koblitz, Neal,1948-degree supervisor.",Neal Koblitz,,,,http://hdl.handle.net/1773/42458,1773/42458,1078701013
,The Grothendieck Groups of Module Categories Over Coherent Algebras,The Grothendieck Groups of Module Categories Over Coherent Algebras,,Gautam Sisodia,,Gautam Sisodia,University of Washington,,,,Gautam Sisodia,human,doctoral thesis,"doctoral thesis by Gautam Sisodia, 2014",University of Washington,2014,English,"iv, 55 pages ",,55,iv,"Smith, S. P.,1955-degree supervisor.",S. P. Smith,,,,http://hdl.handle.net/1773/26533,1773/26533,898191101
,The Zeros of Elliptic Curve L-functions: Analytic Algorithms With Explicit Time Complexity,The Zeros of Elliptic Curve L-functions,Analytic Algorithms With Explicit Time Complexity,Simon Spicer,,Simon Spicer,University of Washington,,,,Simon Spicer,human,doctoral thesis,"doctoral thesis by Simon Spicer, 2015",University of Washington,2015,English,"iii, 109 pages ",,109,iii,"Stein, William A.,1974-degree supervisor.",William A. Stein,,,,http://hdl.handle.net/1773/34017,1773/34017,936210968
